,Gene,CCPhase,Ensembl Human,Ensembl Mouse,Entrez,count pubmed,Length,name,symbol,map_location,alias,other_names,chr,start,end,strand,summary,kegg,reactome,wikipathways
93,NEK2,G2M,ENSG00000117650,ENSMUSG00000026622,4751,112.0,12846.0,NIMA related kinase 2,NEK2,1q32.3,"['HsPK21', 'NEK2A', 'NLK1', 'PPP1R111', 'RP67']","['NIMA (never in mitosis gene a)-related kinase 2', 'nimA-like protein kinase 1', 'nimA-related protein kinase 2', 'protein phosphatase 1, regulatory subunit 111', 'serine/threonine-protein kinase Nek2']",1,211836114.0,211848960.0,-1.0,"This gene encodes a serine/threonine-protein kinase that is involved in mitotic regulation. This protein is localized to the centrosome, and undetectable during G1 phase, but accumulates progressively throughout the S phase, reaching maximal levels in late G2 phase. Alternatively spliced transcript variants encoding different isoforms with distinct C-termini have been noted for this gene. [provided by RefSeq, Feb 2011].",,22.0,2.0
94,G2E3,G2M,ENSG00000092140,ENSMUSG00000035293,55632,2.0,60940.0,G2/M-phase specific E3 ubiquitin protein ligase,G2E3,14q12,"['KIAA1333', 'PHF7B']","['G2/M phase-specific E3 ubiquitin-protein ligase', 'G2/M phase-specific HECT-type E3 ubiquitin transferase', 'G2/M-phase specific E3 ubiquitin ligase', 'PHD finger protein 7B']",14,31028329.0,31089269.0,1.0,,,,
95,GAS2L3,G2M,ENSG00000139354,ENSMUSG00000074802,283431,4.0,54603.0,growth arrest specific 2 like 3,GAS2L3,12q23.1,G2L3,"['GAS2-like protein 3', 'growth arrest-specific protein 2-like 3']",12,100967461.0,101022064.0,1.0,,,,
96,CBX5,G2M,ENSG00000094916,ENSMUSG00000009575,23468,94.0,49162.0,chromobox 5,CBX5,12q13.13,"['HEL25', 'HP1', 'HP1A']","['HP1 alpha homolog', 'HP1-ALPHA', 'HP1Hs alpha', 'antigen p25', 'chromobox homolog 5 (HP1 alpha homolog, Drosophila)', 'chromobox protein homolog 5', 'epididymis luminal protein 25', 'heterochromatin protein 1 homolog alpha', 'heterochromatin protein 1-alpha']",12,54624724.0,54673886.0,-1.0,"This gene encodes a highly conserved nonhistone protein, which is a member of the heterochromatin protein family. The protein is enriched in the heterochromatin and associated with centromeres. The protein has a single N-terminal chromodomain which can bind to histone proteins via methylated lysine residues, and a C-terminal chromo shadow-domain (CSD) which is responsible for the homodimerization and interaction with a number of chromatin-associated nonhistone proteins. The encoded product is involved in the formation of functional kinetochore through interaction with essential kinetochore proteins. The gene has a pseudogene located on chromosome 3. Multiple alternatively spliced variants, encoding the same protein, have been identified. [provided by RefSeq, Jul 2008].",,11.0,2.0
97,CENPA,G2M,ENSG00000115163,ENSMUSG00000029177,1058,111.0,36778.0,centromere protein A,CENPA,2p23.3,"['CENP-A', 'CenH3']","['centromere autoantigen A', 'centromere protein A, 17kDa', 'centromere-specific histone', 'histone H3-like centromeric protein A']",2,26987157.0,27023935.0,1.0,"Centromeres are the differentiated chromosomal domains that specify the mitotic behavior of chromosomes. This gene encodes a centromere protein which contains a histone H3 related histone fold domain that is required for targeting to the centromere. Centromere protein A is proposed to be a component of a modified nucleosome or nucleosome-like structure in which it replaces 1 or both copies of conventional histone H3 in the (H3-H4)2 tetrameric core of the nucleosome particle. The protein is a replication-independent histone that is a member of the histone H3 family. Alternative splicing results in multiple transcript variants encoding distinct isoforms. [provided by RefSeq, Nov 2015].",,21.0,
